{"aggregate":{"cases":16,"command_dispositions":145,"exact_twins":16,"feature_domains":18,"maximum_wall_seconds":0.162688,"native_runs":32,"negative_cases":3},"artifact_root":"/home/thecl/.codex/artifacts/openttd-rl/v2-m21-broad-f","cases":[{"case_id":"calendar-temperate-s0","landscape":"temperate","probe":"calendar","replicates":[{"name":"a","normalized_sha256":"77657af0cf1c29b83244d230761934fddfb63a4591e0c620ea1894b37fc1ae1f","report_path":"calendar-temperate-s0/replicate-a/report.json","report_sha256":"6eae876cce59bd28162aa560a714b1fcb49481bd284fcf82e9b02b6b17838cbf","save":{"bytes":10208,"sha256":"f64222f68f3ebc58ea6b78455bea610618003ead9dbbb86a1a8db639dd42ba8b"},"wall_seconds":0.114323},{"name":"b","normalized_sha256":"77657af0cf1c29b83244d230761934fddfb63a4591e0c620ea1894b37fc1ae1f","report_path":"calendar-temperate-s0/replicate-b/report.json","report_sha256":"0bdc64efd77c84d918a228f305019359022a26c4fd6da505de3aa61d1e663996","save":{"bytes":10208,"sha256":"f64222f68f3ebc58ea6b78455bea610618003ead9dbbb86a1a8db639dd42ba8b"},"wall_seconds":0.110131}],"seed":21001,"twin_exact":true},{"case_id":"calendar-temperate-s1","landscape":"temperate","probe":"calendar","replicates":[{"name":"a","normalized_sha256":"408d34e0e7d755ceb94ca9729393867b65d7dee0ef74d9001765dc8ccdef85d0","report_path":"calendar-temperate-s1/replicate-a/report.json","report_sha256":"7a5c5820508bac9860972004b4112ef15437ef7bf4459548b84ed238362d41aa","save":{"bytes":10208,"sha256":"0c66829ce145609964a7c138a0eb0da9a6491430d3d22db16120faa7764755fe"},"wall_seconds":0.1194},{"name":"b","normalized_sha256":"408d34e0e7d755ceb94ca9729393867b65d7dee0ef74d9001765dc8ccdef85d0","report_path":"calendar-temperate-s1/replicate-b/report.json","report_sha256":"44dd7a0df94da7a59c62d9ed040b97dfd46c556d132e769db71e9b33bbf58702","save":{"bytes":10208,"sha256":"0c66829ce145609964a7c138a0eb0da9a6491430d3d22db16120faa7764755fe"},"wall_seconds":0.122083}],"seed":21002,"twin_exact":true},{"case_id":"calendar-arctic-s0","landscape":"arctic","probe":"calendar","replicates":[{"name":"a","normalized_sha256":"b14c3340433280759e25401296ac8eee0d99d1f7456ce35f4c8b8f9f485aa22a","report_path":"calendar-arctic-s0/replicate-a/report.json","report_sha256":"4c0c72fa0cd2a0ed725cd7603909c96e8febc40483cf82960fc69e604f39a8fd","save":{"bytes":10204,"sha256":"f049d5807ba3089756929b04d209a20641a34f78979700437530244698824243"},"wall_seconds":0.136827},{"name":"b","normalized_sha256":"b14c3340433280759e25401296ac8eee0d99d1f7456ce35f4c8b8f9f485aa22a","report_path":"calendar-arctic-s0/replicate-b/report.json","report_sha256":"6e09dcb72ad9a7f689af276383ad52cde90c30c62bed83d908acddea598c0124","save":{"bytes":10204,"sha256":"f049d5807ba3089756929b04d209a20641a34f78979700437530244698824243"},"wall_seconds":0.113085}],"seed":21101,"twin_exact":true},{"case_id":"calendar-arctic-s1","landscape":"arctic","probe":"calendar","replicates":[{"name":"a","normalized_sha256":"27f592efd8682d0b2253fbd492dc75bca846e43263fc3d4439284f6cb0928cff","report_path":"calendar-arctic-s1/replicate-a/report.json","report_sha256":"597c8ce1489b9197d00c8ea4357e80f8f2269254674cdcef8a4a3387a372f9e4","save":{"bytes":10204,"sha256":"808c9ea24cca2cd78ac8e88376f88ce9f506011a44cfcfb96dabfa9d9a1d46de"},"wall_seconds":0.112007},{"name":"b","normalized_sha256":"27f592efd8682d0b2253fbd492dc75bca846e43263fc3d4439284f6cb0928cff","report_path":"calendar-arctic-s1/replicate-b/report.json","report_sha256":"4af6bb6ce8d963fcb6c06e09306e50fe5aa36bdb53cab4a31203765833d589f2","save":{"bytes":10204,"sha256":"808c9ea24cca2cd78ac8e88376f88ce9f506011a44cfcfb96dabfa9d9a1d46de"},"wall_seconds":0.109869}],"seed":21102,"twin_exact":true},{"case_id":"calendar-tropic-s0","landscape":"tropic","probe":"calendar","replicates":[{"name":"a","normalized_sha256":"ce58b2ca3e8336996ed27ae49c9666a0d6abf90401e6ab3d1d084b6789251fc6","report_path":"calendar-tropic-s0/replicate-a/report.json","report_sha256":"792833c1d2df62fc41724a8228d38e0ff42587a7b00cb45cea895ccc56aee431","save":{"bytes":10172,"sha256":"4f73c8c9db0adfd4bc18597297762ed9228e4499a4cf7896281053906bcecc17"},"wall_seconds":0.108175},{"name":"b","normalized_sha256":"ce58b2ca3e8336996ed27ae49c9666a0d6abf90401e6ab3d1d084b6789251fc6","report_path":"calendar-tropic-s0/replicate-b/report.json","report_sha256":"7bf54414307044d7ca91711f4c9fd0acd17ecc0d8a8d5398c805e96d55213c3b","save":{"bytes":10172,"sha256":"4f73c8c9db0adfd4bc18597297762ed9228e4499a4cf7896281053906bcecc17"},"wall_seconds":0.109432}],"seed":21201,"twin_exact":true},{"case_id":"calendar-tropic-s1","landscape":"tropic","probe":"calendar","replicates":[{"name":"a","normalized_sha256":"985f1f3f338c2fd57d044a0191993170cad4a7c16e1a6a3fbad78d62f55be164","report_path":"calendar-tropic-s1/replicate-a/report.json","report_sha256":"c656c61eeb7bcdbe3c74d5e4306e213ce6b0243d9736cf7c4e085efe2b3a435c","save":{"bytes":10192,"sha256":"0d27ac5555a9251857030b62d583566f8771b7464ad149d0dd9e7439ed82992e"},"wall_seconds":0.109799},{"name":"b","normalized_sha256":"985f1f3f338c2fd57d044a0191993170cad4a7c16e1a6a3fbad78d62f55be164","report_path":"calendar-tropic-s1/replicate-b/report.json","report_sha256":"6c6e17e928270f7267245b9ae4141d33b297ef2dd6b90a44f010af74392a4840","save":{"bytes":10192,"sha256":"0d27ac5555a9251857030b62d583566f8771b7464ad149d0dd9e7439ed82992e"},"wall_seconds":0.107517}],"seed":21202,"twin_exact":true},{"case_id":"calendar-toyland-s0","landscape":"toyland","probe":"calendar","replicates":[{"name":"a","normalized_sha256":"795e448d1a2cdb3a053c0025ef0d09da3c403b5b5a7bc5d3c81abeed2a2dc036","report_path":"calendar-toyland-s0/replicate-a/report.json","report_sha256":"fc77580039bddcfb09ad5b14c0a4eb72fb62094f3852f55342af8ccd86c66ecc","save":{"bytes":10160,"sha256":"2244bc7fcdfde1d226bb87bba7527c3b46ca44f0d9501ecfba14c6fe4b0b7045"},"wall_seconds":0.11314},{"name":"b","normalized_sha256":"795e448d1a2cdb3a053c0025ef0d09da3c403b5b5a7bc5d3c81abeed2a2dc036","report_path":"calendar-toyland-s0/replicate-b/report.json","report_sha256":"19c12c9863e1ea825b5a9e8eb7e7a4a9012ef795ff93a3af3cee635ac2cbdd8b","save":{"bytes":10160,"sha256":"2244bc7fcdfde1d226bb87bba7527c3b46ca44f0d9501ecfba14c6fe4b0b7045"},"wall_seconds":0.114107}],"seed":21301,"twin_exact":true},{"case_id":"calendar-toyland-s1","landscape":"toyland","probe":"calendar","replicates":[{"name":"a","normalized_sha256":"5ab1737be6d0c24cab6e4e930ffe1060a110258803ec17ca0d61ec484c495fd5","report_path":"calendar-toyland-s1/replicate-a/report.json","report_sha256":"aab95b12f0c4eb25a3a0c01d4ea2904db426d7b93104d80876f5b408b299523a","save":{"bytes":10244,"sha256":"d6be7eeeea7d2d5108d92825e03bc1f8591ad45882a930c62bfad1a9a89acd34"},"wall_seconds":0.105562},{"name":"b","normalized_sha256":"5ab1737be6d0c24cab6e4e930ffe1060a110258803ec17ca0d61ec484c495fd5","report_path":"calendar-toyland-s1/replicate-b/report.json","report_sha256":"0f10f7ce2f447aaf3da65396029fbd1cdbf935e61d0ea00fa66f613858de899e","save":{"bytes":10244,"sha256":"d6be7eeeea7d2d5108d92825e03bc1f8591ad45882a930c62bfad1a9a89acd34"},"wall_seconds":0.104492}],"seed":21302,"twin_exact":true},{"case_id":"authority-economy-s0","landscape":"temperate","probe":"authority_economy","replicates":[{"name":"a","normalized_sha256":"a843495ff3b2ea1e3e940d6fc6bf98e151787b7e2389b4581407c4f7c7d16679","report_path":"authority-economy-s0/replicate-a/report.json","report_sha256":"f020889f7ccdfaacc748c11cbd12c77d906901ba9c8c2c6de017710d0007171a","save":{"bytes":10340,"sha256":"e4c9770c10339515e3cdd2d18b6f7b6978f97235ebb31ab75fd276e0fa1a16ad"},"wall_seconds":0.110774},{"name":"b","normalized_sha256":"a843495ff3b2ea1e3e940d6fc6bf98e151787b7e2389b4581407c4f7c7d16679","report_path":"authority-economy-s0/replicate-b/report.json","report_sha256":"8319a3e7c466be15fded963837379a27f3ad664f56931b19c65ef47d95a2c6a7","save":{"bytes":10340,"sha256":"e4c9770c10339515e3cdd2d18b6f7b6978f97235ebb31ab75fd276e0fa1a16ad"},"wall_seconds":0.110783}],"seed":21401,"twin_exact":true},{"case_id":"authority-economy-s1","landscape":"temperate","probe":"authority_economy","replicates":[{"name":"a","normalized_sha256":"d296ba9729a34dfc1ceefb12cbd4a22de7cbbcdd429fa0b11a0cf2851e5bfadb","report_path":"authority-economy-s1/replicate-a/report.json","report_sha256":"7ecec93f62d9376464e714b63ee8e704cf9f52e54420717a981fb11c2ad1cb6c","save":{"bytes":10380,"sha256":"01bc65248e72c6633a43a373ec0b3912d8f4fb7054b9ce6e601803485e20a2a2"},"wall_seconds":0.117322},{"name":"b","normalized_sha256":"d296ba9729a34dfc1ceefb12cbd4a22de7cbbcdd429fa0b11a0cf2851e5bfadb","report_path":"authority-economy-s1/replicate-b/report.json","report_sha256":"80f756817d19d2dd05e2fc2101c6f462d3b0d66f27c5bf8e5f09af7e4ef4cb79","save":{"bytes":10380,"sha256":"01bc65248e72c6633a43a373ec0b3912d8f4fb7054b9ce6e601803485e20a2a2"},"wall_seconds":0.119555}],"seed":21402,"twin_exact":true},{"case_id":"events-s0","landscape":"temperate","probe":"events","replicates":[{"name":"a","normalized_sha256":"bf8f811260e02e210e0e885f727af919e6fa232c5485fc14bb27c5d02cd2e49a","report_path":"events-s0/replicate-a/report.json","report_sha256":"5025869042c21c8030316c76f6e5a1f8991ff21395f9e6d511a13341bf53e29f","save":{"bytes":10172,"sha256":"c6e2e5858a61e847a2ba7c592af2eb86c64b1b76afb74f54a0a5e7d160186b95"},"wall_seconds":0.114821},{"name":"b","normalized_sha256":"bf8f811260e02e210e0e885f727af919e6fa232c5485fc14bb27c5d02cd2e49a","report_path":"events-s0/replicate-b/report.json","report_sha256":"f6aa14f265c496877416689150202dca8caaa4036b2d636fa82e18c9fad05a45","save":{"bytes":10172,"sha256":"c6e2e5858a61e847a2ba7c592af2eb86c64b1b76afb74f54a0a5e7d160186b95"},"wall_seconds":0.109524}],"seed":21501,"twin_exact":true},{"case_id":"events-s1","landscape":"temperate","probe":"events","replicates":[{"name":"a","normalized_sha256":"ef5f3d4e14ac6335537a3baf2178d28403d8b81b246e8d20e6c673ff2a63bafb","report_path":"events-s1/replicate-a/report.json","report_sha256":"30dd6cd6cbee1e85e680162b1e7ca54a4cc211aabb76ea5a7ee9def53657e166","save":{"bytes":10196,"sha256":"9505ea66bf9fc8cb313d5dd7b267f70c7b00046